URN,CustomerName,Address1,Address2,Address3,Town,County,Country,PostCode,Sector,Subsector,Active
10009042,Lancashire Magistrates Court,Garstang,Preston,Lancashire,Preston,Lancashire,England,PR3 1EY,Central Government,,True
10008839,The Insolvency Service,"21 Bloomsbury Street,",London,Greater London,London,Greater London,England,WC1B 3QW,Central Government,Executive Agency,True
10008836,Inner London Magistrates Court Service,JCE Offices 65 Romney Road,London,Greater London,London,Greater London,England,SW1P 3RD,Central Government,,True
10008818,Independent Housing Ombudsman,2nd Floor 81 Aldwych,London,Greater London,London,Greater London,England,WC2B 4HN,Central Government,Executive non-departmental public body,True
10008789,Human Fertilisation and Embryology Authority,Finsbury Tower 103-105 Bunhill Row,London,Greater London,London,Greater London,England,EC1Y 8HF,Central Government,Executive non-departmental public body,True
10008684,HM Prison Morton Hall,"4 Park Crescent, Swinderby",Lincoln,Lincolnshire,Lincoln,Lincolnshire,England,LN6 9HU,Central Government,Prisons,True
10008654,HM Inspectorate of Probation,"6th Floor, South Wing, Trafford House Chester Road Stretford",Manchester,Greater Manchester,Manchester,Greater Manchester,England,M32 0RS,Central Government,Other,True
10008621,Highbury Corner Magistrates Court,51 Holloway Road,London,Greater London,London,Greater London,England,N7 8JA,Central Government,,True
10008618,High Peak Borough Council,Buxton Town Hall Market Place,Buxton,Derbyshire,Buxton,Derbyshire,England,SK17 6EL,Wider Public Sector,Region: East Midlands,True
10008433,Greater London Magistrates Court Service,The Property & Contracts Dept 185 Marlebone Road,London,Greater London,London,Greater London,England,NW1 5QL,Central Government,,True
10008141,Employment Tribunal,3rd Floor Alexandra House 14-22 The Parsonage,Manchester,Greater Manchester,Manchester,Greater Manchester,England,M3 2JA,Central Government,TBA,True
10008000,Duke of Yorks Royal Military School,Estates Office Building 71,Dover,Kent,Dover,Kent,England,CT15 5EQ,Central Government,Specialist Schools,True
10007845,Defence Academy of the United Kingdom,Building 15 Greenhill House Shrivenham,Swindon,Wiltshire,Swindon,Wiltshire,England,SN6 8LA,Central Government,Specialist Schools,True
10007764,Criminal Injuries Compensation Authority,Morley House 26-30 Holborn Viaduct 300 Bath Street,London,Greater London,London,Greater London,England,EC1A 2JQ,Central Government,Executive Agency,True
10007742,First-Tier Tribunal (Asylum and Immigration),4th Floor Cardinal Tower 12 Farringdon Road,London,Greater London,London,Greater London,England,EC1M 3BA,Central Government,TBA,True
10007515,Children and Family Court Advisory and Support Service (CAFCASS),13th/14th Floors Archway Tower 2 Junction Road,London,Greater London,London,Greater London,England,N19 5HQ,Central Government,Executive non-departmental public body,True
10007343,Project Phoenix,Elm 1a Mod Abbywood Station Road,Bristol,Gloucestershire,Bristol,Gloucestershire,England,BS34 8JH,Central Government,,True
10007029,Balladen Community Primary School,Linden Lea Rawtenstall,Rossendale,Lancashire,Rossendale,Lancashire,England,BB4 6DX,Wider Public Sector,Local Authority Maintained School (All Types),True
10007018,Babcock Rosyth Defence Limited,Wood Road Rosyth Royal Dockyard,Dunfermline,Fife,Dunfermline,Fife,Scotland,KY11 2YD,Central Government,,True
10007016,Babcock (RAF Contract),Building 22 RAF Wittering,Peterborough,Cambridgeshire,Peterborough,Cambridgeshire,England,PE8 6HB,Central Government,,True
10006663,Leeds College of Art,"Jacob Kramer Building, Blenheim Walk,","Leeds,",West Yorkshire,"Leeds,",West Yorkshire,England,LS2 9AQ.,Wider Public Sector,Colleges of Higher Education,True
10006610,Bradford Court Centre,Exchange Sq Drake St,Bradford,West Yorkshire,Bradford,West Yorkshire,England,BD1 1JA,Central Government,,True
10006298,West Mercia Magistrates Courts,17 The Moorings,Oldbury,West Midlands,Oldbury,West Midlands,England,B69 2DD,Central Government,,True
10006164,Criminal Cases Review Commission,21st Floor Alpha Tower Suffolk Street Queensway Queensway,Birmingham,West Midlands,Birmingham,West Midlands,England,B1 1TT,Central Government,Executive non-departmental public body,True
10006163,Coventry University,"Priory Street,",Coventry,West Midlands,Coventry,West Midlands,England,CV1 5FB,Wider Public Sector,Universities,True
10005730,LEAP Multi Academy Trust,Brinsworth Road,Rotherham,South Yorkshire,Rotherham,South Yorkshire,England,S60 5EJ,Wider Public Sector,Academy (All Types),True
10005722,South Yorkshire Magistrates Court,Unit 9 Meadow Court Amos Road,Sheffield,South Yorkshire,Sheffield,South Yorkshire,England,S9 1BX,Central Government,,True
10004897,Interserve Defence,Buiding 276 RAF Shawbury,Shrewsbury,Shropshire,Shrewsbury,Shropshire,England,SY4 4DZ,Central Government,,True
10004797,Queen Victoria School,School Office,Dunblane,Perthshire,Dunblane,Perthshire,Scotland,FK15 0JY,Central Government,Specialist Schools,True
10003990,Mersey Care NHS Trust,Princess Dock 8 Princes Parade St Nicholas Place,LIVERPOOL,Merseyside,LIVERPOOL,Merseyside,England,L3 1DL,Wider Public Sector,Mental Health Trust,True
10003981,Liverpool Magistrates Courts,"2nd Floor Port of Liverpool Building, Pier Head",Liverpool,Merseyside,Liverpool,Merseyside,England,L3 1BY,Central Government,,True
10003939,Birkenhead Sixth Form College,"Park Road West, Claughton, Wirral",Birkenhead,Merseyside,Birkenhead,Merseyside,England,CH43 8SQ,Wider Public Sector,Colleges of Further Education,True
10003914,Uxbridge Magistrates Court,Harfield Road,Uxbridge,Middlesex,Uxbridge,Middlesex,England,UB8 1PQ,Central Government,,True
10003611,Leicestershire Magistrates Courts,Secretariat Unit Upper Bond Street,Hinckley,Leicestershire,Hinckley,Leicestershire,England,LE67 4PD,Central Government,,True
10003514,Museum of Science and Industry,Liverpool Road Castlefield,Manchester,,Manchester,,,M3 4FP,Central Government,Museums,True
10002926,Bromley County Court,College Rd,Bromley,Kent,Bromley,Kent,England,BR1 3PX,Central Government,,True
10002911,Bexley Magistrates Courts,Norwich Place,Bexleyheath,Kent,Bexleyheath,Kent,England,BA6 8NB,Central Government,,True
10002686,National Institute for Biological Standards and Control,Blanche Lane South Mimms,Potters Bar,Hertfordshire,Potters Bar,Hertfordshire,England,EN6 3QG.,Central Government,TBA,True
10002519,SODEXHO Defence Services,Logic Support Group Knollys Road,Aldershot,Hampshire,Aldershot,Hampshire,England,GU11 1PN,Central Government,,True
10001202,Plymouth City Council,10th Floor Civic Centre Prince Rock,PLYMOUTH,Devon,PLYMOUTH,Devon,England,PL1 2EW,Wider Public Sector,Region:South West,True
10000643,Chester Magistrate Courts,Grosvenor Street,Chester,Cheshire,Chester,Cheshire,England,CH1 2XA,Central Government,,True
10000460,Royal Air Force (RAF) - Headquarters,Royal Air Force High Wycombe Naphill,High Wycombe,,High Wycombe,,,HP14 4UE,Central Government,MoD - RAF,True
